Sheet: Sheet1
A1: State | B1: Max Height (ft) | C1: Notes | D1: Source | E1: Quote | F1: pg # | G1: Conflicts/Comments
A2: Alabama | B2: 13 1/2 | D2: https://www.dot.state.al.us/maweb/doc/Title32Chapter9.pdf | E2: "No vehicle or semi-trailer or trailer shall exceed in height13 Â½ feet, including load." | F2: 3
A3: Alaska | B3: 14 | C3: WASHTO | D3: http://www.wsdot.wa.gov/NR/rdonlyres/EF9BD746-33DC-4A7F-A7FA-744897188D64/0/WASHTOGuide2009.pdf | E3: "Height :Maximum vehicle height: 14 feet." | F3: 15 | G3: of:=HYPERLINK("http://dnr.alaska.gov/ag/Index/Chapter25.pdf";"PAGE 5: ""A vehicle, including load, may not exceed a height of 15feet, except that avehicle operating between the Fox Weigh Station and Prudhoe Bay on the Daltonand Elliott Highways may have a height, including load, of 17 feet. "" ") -> PAGE 5: "A vehicle, including load, may not exceed a height of 15feet, except that avehicle operating between the Fox Weigh Station and Prudhoe Bay on the Daltonand Elliott Highways may have a height, including load, of 17 feet. " 
A4: Arizona | B4: of:=[.$B$3] -> 14 | C4: of:=[.$C$3] -> WASHTO | D4: of:=[.$D3] -> http://www.wsdot.wa.gov/NR/rdonlyres/EF9BD746-33DC-4A7F-A7FA-744897188D64/0/WASHTOGuide2009.pdf | E4: of:=[.$E$3] -> "Height :Maximum vehicle height: 14 feet." | F4: of:=[.$F$3] -> 15
A5: Arkansas | B5: 13'6 | D5: http://www.sos.arkansas.gov/rulesRegs/Arkansas%20Register/2014/nov2014/001.00.14-001.pdf | E5: "HEIGHT: 13 feet, 6 inches | F5: 8 | G5: of:=HYPERLINK("http://www.sos.arkansas.gov/rulesRegs/Arkansas%20Register/2014/nov2014/001.00.14-001.pdf";"PAGE 8: ""WIDTH: 8 feet, 6 inches (8 feet for manufactured homes)""") -> PAGE 8: "WIDTH: 8 feet, 6 inches (8 feet for manufactured homes)"
A6: California | B6: of:=[.$B$3] -> 14 | C6: of:=[.$C$3] -> WASHTO | D6: of:=[.$D3] -> http://www.wsdot.wa.gov/NR/rdonlyres/EF9BD746-33DC-4A7F-A7FA-744897188D64/0/WASHTOGuide2009.pdf | E6: of:=[.$E$3] -> "Height :Maximum vehicle height: 14 feet." | F6: of:=[.$F$3] -> 15
A7: Colorado | B7: of:=[.$B$3] -> 14 | C7: of:=[.$C$3] -> WASHTO | D7: of:=[.$D3] -> http://www.wsdot.wa.gov/NR/rdonlyres/EF9BD746-33DC-4A7F-A7FA-744897188D64/0/WASHTOGuide2009.pdf | E7: of:=[.$E$3] -> "Height :Maximum vehicle height: 14 feet." | F7: of:=[.$F$3] -> 15
A8: Connecticut | B8: 13'6 | D8: http://www.ct.gov/dot/lib/dot/Documents/dpermits/eh_ndlgi.pdf | E8: "Height - 13 feet 6 inches " | F8: 4 | G8: of:=HYPERLINK("http://delcode.delaware.gov/title21/c045/index.shtml";"""The liability for damage to any person, vehicle, structure or other property caused by any vehicle having a height, including any load thereon, in excess of 12 feet 6 inches shall be borne by the owner and/or the operator of the vehicle.""") -> "The liability for damage to any person, vehicle, structure or other property caused by any vehicle having a height, including any load thereon, in excess of 12 feet 6 inches shall be borne by the owner and/or the operator of the vehicle."
A9: Delaware
A10: District of Columbia
A11: Florida
A12: Georgia
A13: Hawaii | B13: of:=[.$B$3] -> 14 | C13: of:=[.$C$3] -> WASHTO | D13: of:=[.$D3] -> http://www.wsdot.wa.gov/NR/rdonlyres/EF9BD746-33DC-4A7F-A7FA-744897188D64/0/WASHTOGuide2009.pdf | E13: of:=[.$E$3] -> "Height :Maximum vehicle height: 14 feet." | F13: of:=[.$F$3] -> 15
A14: Idaho | B14: of:=[.$B$3] -> 14 | C14: of:=[.$C$3] -> WASHTO | D14: of:=[.$D3] -> http://www.wsdot.wa.gov/NR/rdonlyres/EF9BD746-33DC-4A7F-A7FA-744897188D64/0/WASHTOGuide2009.pdf | E14: of:=[.$E$3] -> "Height :Maximum vehicle height: 14 feet." | F14: of:=[.$F$3] -> 15
A15: Illinois
A16: Indiana
A17: Iowa
A18: Kansas
A19: Kentucky
A20: Louisiana
A21: Maine
A22: Maryland
A23: Massachusetts
A24: Michigan
A25: Minnesota
A26: Mississippi
A27: Missouri
A28: Montana | B28: of:=[.$B$3] -> 14 | C28: of:=[.$C$3] -> WASHTO | D28: of:=[.$D3] -> http://www.wsdot.wa.gov/NR/rdonlyres/EF9BD746-33DC-4A7F-A7FA-744897188D64/0/WASHTOGuide2009.pdf | E28: of:=[.$E$3] -> "Height :Maximum vehicle height: 14 feet." | F28: of:=[.$F$3] -> 15
A29: Nebraska | B29: of:=[.$B$3] -> 14 | C29: of:=[.$C$3] -> WASHTO | D29: of:=[.$D3] -> http://www.wsdot.wa.gov/NR/rdonlyres/EF9BD746-33DC-4A7F-A7FA-744897188D64/0/WASHTOGuide2009.pdf | E29: of:=[.$E$3] -> "Height :Maximum vehicle height: 14 feet." | F29: of:=[.$F$3] -> 15
A30: Nevada | B30: of:=[.$B$3] -> 14 | C30: of:=[.$C$3] -> WASHTO | D30: of:=[.$D3] -> http://www.wsdot.wa.gov/NR/rdonlyres/EF9BD746-33DC-4A7F-A7FA-744897188D64/0/WASHTOGuide2009.pdf | E30: of:=[.$E$3] -> "Height :Maximum vehicle height: 14 feet." | F30: of:=[.$F$3] -> 15
A31: New Hampshire
A32: New Jersey
A33: New Mexico | B33: of:=[.$B$3] -> 14 | C33: of:=[.$C$3] -> WASHTO | D33: of:=[.$D3] -> http://www.wsdot.wa.gov/NR/rdonlyres/EF9BD746-33DC-4A7F-A7FA-744897188D64/0/WASHTOGuide2009.pdf | E33: of:=[.$E$3] -> "Height :Maximum vehicle height: 14 feet." | F33: of:=[.$F$3] -> 15
A34: New York
A35: North Carolina
A36: North Dakota | B36: of:=[.$B$3] -> 14 | C36: of:=[.$C$3] -> WASHTO | D36: of:=[.$D3] -> http://www.wsdot.wa.gov/NR/rdonlyres/EF9BD746-33DC-4A7F-A7FA-744897188D64/0/WASHTOGuide2009.pdf | E36: of:=[.$E$3] -> "Height :Maximum vehicle height: 14 feet." | F36: of:=[.$F$3] -> 15
A37: Ohio
A38: Oklahoma | B38: of:=[.$B$3] -> 14 | C38: of:=[.$C$3] -> WASHTO | D38: of:=[.$D3] -> http://www.wsdot.wa.gov/NR/rdonlyres/EF9BD746-33DC-4A7F-A7FA-744897188D64/0/WASHTOGuide2009.pdf | E38: of:=[.$E$3] -> "Height :Maximum vehicle height: 14 feet." | F38: of:=[.$F$3] -> 15
A39: Oregon | B39: of:=[.$B$3] -> 14 | C39: of:=[.$C$3] -> WASHTO | D39: of:=[.$D3] -> http://www.wsdot.wa.gov/NR/rdonlyres/EF9BD746-33DC-4A7F-A7FA-744897188D64/0/WASHTOGuide2009.pdf | E39: of:=[.$E$3] -> "Height :Maximum vehicle height: 14 feet." | F39: of:=[.$F$3] -> 15
A40: Pennsylvania
A41: Puerto Rico
A42: Rhode Island
A43: South Carolina
A44: South Dakota | B44: of:=[.$B$3] -> 14 | C44: of:=[.$C$3] -> WASHTO | D44: of:=[.$D3] -> http://www.wsdot.wa.gov/NR/rdonlyres/EF9BD746-33DC-4A7F-A7FA-744897188D64/0/WASHTOGuide2009.pdf | E44: of:=[.$E$3] -> "Height :Maximum vehicle height: 14 feet." | F44: of:=[.$F$3] -> 15
A45: Tennessee
A46: Texas | B46: of:=[.$B$3] -> 14 | C46: of:=[.$C$3] -> WASHTO | D46: of:=[.$D3] -> http://www.wsdot.wa.gov/NR/rdonlyres/EF9BD746-33DC-4A7F-A7FA-744897188D64/0/WASHTOGuide2009.pdf | E46: of:=[.$E$3] -> "Height :Maximum vehicle height: 14 feet." | F46: of:=[.$F$3] -> 15
A47: Utah | B47: of:=[.$B$3] -> 14 | C47: of:=[.$C$3] -> WASHTO | D47: of:=[.$D3] -> http://www.wsdot.wa.gov/NR/rdonlyres/EF9BD746-33DC-4A7F-A7FA-744897188D64/0/WASHTOGuide2009.pdf | E47: of:=[.$E$3] -> "Height :Maximum vehicle height: 14 feet." | F47: of:=[.$F$3] -> 15
A48: Vermont
A49: Virginia
A50: Washington | B50: of:=[.$B$3] -> 14 | C50: of:=[.$C$3] -> WASHTO | D50: of:=[.$D3] -> http://www.wsdot.wa.gov/NR/rdonlyres/EF9BD746-33DC-4A7F-A7FA-744897188D64/0/WASHTOGuide2009.pdf | E50: of:=[.$E$3] -> "Height :Maximum vehicle height: 14 feet." | F50: of:=[.$F$3] -> 15
A51: West Virginia
A52: Wisconsin
A53: Wyoming | B53: of:=[.$B$3] -> 14 | C53: of:=[.$C$3] -> WASHTO | D53: of:=[.$D$3] -> 0 | E53: of:=[.$E$3] -> "Height :Maximum vehicle height: 14 feet." | F53: of:=[.$F$3] -> 15